{
  "type": "BUNDLE",
  "id": "fa7188b5-6676-4028-acf1-42741f0a3ba9",
  "marketplace_id": "fa7188b5-6676-4028-acf1-42741f0a3ba9",
  "name": "Burger: Gold Edition Costume",
  "description": "The delicious burger costume you know and love, now in an epic gold variant. It doesnâ€™t get better than this!\r\n\r\nFeatures:\r\n+ Custom 3D geometry that makes you stand out from the crowd!\r\n+ Works in hubs and games\r\n+ Includes \"The Gold Edition\" hub title\r\n+ Includes \"Royal Burger\" avatar\r\n\r\nNote: This costume only works on The Hive server",
  "thumbnail": "https://xforgeassets002.xboxlive.com/serviceid-18231953-4b1d-472c-a39e-48b10105b7b7/63c76458-03b1-42a8-aebb-3ad38b02098f/burgergold_Thumbnail_0.jpg",
  "price": 310,
  "currency": "MINECOIN",
  "released_at": "2019-06-27T10:00:00Z"
}
