{
  "type": "BUNDLE",
  "id": "2525b0b9-31a9-4fcf-919e-819817eddcc1",
  "marketplace_id": "2525b0b9-31a9-4fcf-919e-819817eddcc1",
  "name": "Cactus Costume",
  "description": "This costume will definitely grow on you! Just stay away from balloons...\r\n\r\nFeatures:\r\n+ Custom 3D geometry that makes you stand out from the crowd!\r\n+ Works in hubs and games\r\n+ Includes \"The Spikey\" hub title\r\n+ Includes \"Adorable Cactus\" avatar\r\n\r\nNote: This costume only works on The Hive server",
  "thumbnail": "https://xforgeassets001.xboxlive.com/serviceid-18231953-4b1d-472c-a39e-48b10105b7b7-public/68b1357a-c2c8-456c-ad61-44ae9dcf8cf7/cactus_Thumbnail_0.jpg",
  "price": 160,
  "currency": "MINECOIN",
  "released_at": "2019-03-22T10:00:00+00:00"
}