{
  "type": "BUNDLE",
  "id": "094fd0a0-5528-4883-9f0c-f279d7ce82cc",
  "marketplace_id": "094fd0a0-5528-4883-9f0c-f279d7ce82cc",
  "name": "Fineapple Costume",
  "description": "Pineapples are people too, right?\r\n\r\nFeatures:\r\n+ Custom 3D geometry that makes you stand out from the crowd!\r\n+ Works in hubs and games\r\n+ Includes \"LOOKIN' PINE\" hub title\r\n+ Includes \"Summer Pineapple\" avatar\r\n\r\nNote: This costume only works on The Hive server",
  "thumbnail": "https://xforgeassets002.xboxlive.com/pf-title-b63a0803d3653643-20ca2/e2a8ed73-b0fd-4d70-b1d7-d7d1c977b227/fineapple_Thumbnail_0.jpg",
  "price": 160,
  "currency": "MINECOIN",
  "released_at": "2020-07-24T17:00:00Z"
}
