{
  "type": "BUNDLE",
  "id": "a65c6795-bb7c-4aed-b4b4-9c60d2eb3db8",
  "marketplace_id": "a65c6795-bb7c-4aed-b4b4-9c60d2eb3db8",
  "name": "Juicy Costume",
  "description": "Tomatoes are fruit. It's important you know that.\r\n\r\nFeatures:\r\n+ Custom 3D geometry that makes you stand out from the crowd!\r\n+ Works in hubs and games\r\n+ Includes \"Ketchup with me!\" hub title\r\n+ Includes \"Cute Tomato\" avatar\r\n\r\nNote: This costume only works on The Hive server",
  "thumbnail": "https://xforgeassets001.xboxlive.com/pf-title-b63a0803d3653643-ee7b/61a9c8df-37f4-4c07-8d8b-915379cf69b3/juicy_Thumbnail_0.jpg",
  "price": 160,
  "currency": "MINECOIN",
  "released_at": "2020-01-16T01:00:00+00:00"
}