{
  "type": "BUNDLE",
  "id": "03dbb32d-0f33-4c12-a481-5833425116d4",
  "marketplace_id": "03dbb32d-0f33-4c12-a481-5833425116d4",
  "name": "Hip Hop Costume",
  "description": "Itâ€™s time to jump for joy with this FREE costume!\n\nFeatures:\n+ Custom 3D geometry that makes you stand out from the crowd!\n+ Works in hubs and games\n+ Includes \"Ribbit\" hub title\n+ Includes \"Cute Frog\" avatar\n\nNote: This costume only works on The Hive server",
  "thumbnail": "https://xforgeassets001.xboxlive.com/serviceid-18231953-4b1d-472c-a39e-48b10105b7b7/09821698-6401-4725-8e86-34a7108e90f1/hiphop_Thumbnail_0.jpg",
  "price": 0,
  "currency": "MINECOIN",
  "released_at": "2019-08-09T10:00:00+00:00"
}