{
  "type": "BUNDLE",
  "id": "a9ab2eda-c93f-402b-8cb0-5facbbf6dd3b",
  "marketplace_id": "a9ab2eda-c93f-402b-8cb0-5facbbf6dd3b",
  "name": "Battle Burger Costume",
  "description": "Ketchup with this costume if you can!\r\n\r\nFeatures:\r\n\r\n+ Custom 3D geometry that makes you stand out from the crowd!\r\n+ Works in hubs and games\r\n+ Includes \"FOOD FIGHT!\" hub title\r\n+ Includes \"Mega Burger\" avatar\r\n\r\nNote: This costume only works on The Hive server",
  "thumbnail": "https://xforgeassets001.xboxlive.com/pf-title-b63a0803d3653643-20ca2/241d4eb1-e8ff-4139-a800-4f205e74467c/battleburger_Thumbnail_0.jpg",
  "price": 310,
  "currency": "MINECOIN",
  "released_at": "2021-10-07T17:00:00+00:00"
}
