{
  "type": "BUNDLE",
  "id": "50b1c5e1-116e-42d8-80a7-90cae41c1fcd",
  "marketplace_id": "50b1c5e1-116e-42d8-80a7-90cae41c1fcd",
  "name": "Grim Creeper Costume",
  "description": "It's time to get super spoopy!\r\n\r\nFeatures:\r\n+ Custom 3D geometry that makes you stand out from the crowd!\r\n+ Works in hubs and games\r\n+ Includes \"CREEPER? AW MAN!\" hub title\r\n+ Includes \"Grim Creeper\" avatar\r\n\r\nNote: This costume only works on The Hive server",
  "thumbnail": "https://xforgeassets002.xboxlive.com/pf-title-b63a0803d3653643-ee7b/606b784a-8280-4c07-9ec4-16a5f05dc62b/Thumbnail_0.jpg",
  "price": 160,
  "currency": "MINECOIN",
  "released_at": "2019-10-10T10:00:00+00:00"
}