{
  "type": "BUNDLE",
  "id": "4cb3c1ff-ae99-4f77-8eb6-c9f200e50ca6",
  "marketplace_id": "4cb3c1ff-ae99-4f77-8eb6-c9f200e50ca6",
  "name": "Hoodie Duck Costume",
  "description": "Quack. Quack quack, quack quack. Quack? Quack!\r\n\r\nFeatures:\r\n+ Custom 3D geometry that makes you stand out from the crowd!\r\n+ Works in hubs and games\r\n+ Includes \"You quack me up!\" hub title\r\n+ Includes \"Detective Duck\" avatar\r\n\r\nNote: This costume only works on The Hive server",
  "thumbnail": "https://xforgeassets002.xboxlive.com/pf-title-b63a0803d3653643-ee7b/4db1fed7-08f6-4698-9685-52c8882d3073/hoodieduck_Thumbnail_0.jpg",
  "price": 160,
  "currency": "MINECOIN",
  "released_at": "2020-02-13T09:00:00+00:00"
}